{
  "schema_version": "fusion.hybrid-routing-request/v1",
  "task_id": "EXAMPLE-LOCAL-STRUCTURAL",
  "task_class": "LOCAL_PYTHON_TEST_EXTRACTION",
  "risk_tier": "MEDIUM",
  "contains_restricted_data": true,
  "external_action_required": false,
  "deterministic_oracle_available": true,
  "local_adapter_qualified": true,
  "remote_adapter_qualified": false
}
